{
  "schema_version": "1.0",
  "backend": "local-codex-cli",
  "cloud_fallback": false,
  "review_evidence_format": "local-review-v1",
  "max_worker_seconds": 3600,
  "max_output_bytes": 8388608,
  "claim_ref_prefix": "refs/redteam-local-attempts",
  "review_requires_fresh_process": true,
  "review_requires_read_only": true,
  "worker_github_credentials": false,
  "unattended_review": true
}
